,Автор,Название картины,Ссылка на картину,Описание,Год,Размер,Материал,Техника,Жанр,Стиль,Галерея
0,Айвазовский Иван,Спокойное море,https://opisanie-kartin.ru/ajvazovskij-ivan/spokojnoe-more/,"  Время создания картины «Спокойное море» приходится на взлет творчества Ивана Айвазовского. Как и практически все произведения художника, полотно наполнено морскими мотивами, но от всех остальных, эта картина отличается своей эмоциональной зрелостью, хотя была написана в противоречивый период творчества художника — в тот момент у художника происходила переоценка моральных ценностей. Работа выполнена маслом, и очень хорошо передает игру света и морской воды. Мастерски и ненавязчиво, как бы невзначай, художник направляет взгляд зрителя с морской воды на корабль, который находится вблизи берега. Благодаря большому количества солнечного света около корабля, он не берет на себя главного акцента картины, делая полотно при этом невесомым и хрупким. Морская гладь и штиль — вот канва этого произведения, а всё вокруг – это органичное дополнение. В противовес величественному спокойствию моря Айвазовский добавляет суету людей на берегу, тем самым ещё более придавая значимости, и подчеркивая «главного персонажа» картины — морское спокойствие. ", 1863., 45 x 58 см., холст., масло., марина., романтизм., нет данных.
1,Айвазовский Иван,Неаполитанский залив утром,https://opisanie-kartin.ru/ajvazovskij-ivan/neapolitanskij-zaliv-utrom/,. , 1843., 67 x 100 см., холст., масло., марина., романтизм., нет данных.
2,Айвазовский Иван,Прощание А.С. Пушкина с морем,https://opisanie-kartin.ru/ajvazovskij-ivan/prosshanie-pushkina-s-chernym-morem/,"  «Дивное море написал Айвазовский… И я удостоился намалевать там фигурку», – так прокомментировал свою роль в создании этой картины Илья Репин. Правда, следует признать, что такие характеристики были вообще в стиле Репина – он очень восторженно отзывался об окружающих и весьма уничижительно о своих «скромных дарованиях», такой характер. Впрочем, это ничуть не умаляет достоинств действительно дивного моря, однако и к фигуре не будем столь строги, как автор ее. Пушкин с женой Натальей Гончаровой посетил выставку в Академии художеств. Это был сентябрь 1836 года. Прослышавшие об этом ученики побежали в зал, чтобы посмотреть вблизи на поэта. Среди них был и Айвазовский. Инспектор академии Крутов представил его Пушкину как претендента на золотую медаль. Юному Айвазовскому запало в душу то, как ласково поэт его приветил. Пушкина Айвазовский писал неоднократно. И в целом портреты в его наследии есть, но Айвазовский все же – не портретист, талант его в полную меру проявлялся в изображениях моря и неба. Приглашение Репина в соавторы – решение отличное. Дело в том, что даже когда на картине присутствуют люди, они всегда неизмеримо малы по сравнению с любимой стихией Айвазовского, и речь не только о физическом размере. Искренне восхищаясь «нашим всем», Айвазовский нашел отличный способ не затмить фигуру Пушкина стихией – попросил написать эту фигуру Илью Репина, который был отличным портретистом. В итоге перед нами великолепное море Айвазовского в лучших его проявлениях: бурлящее, живое, неистовое, с прозрачно-изумрудными волнами, с обрушивающейся со скалистого берега водой, море, шум которого слышишь, когда вглядываешься в картину. И яркая, отлично написанная фигура Пушкина. Взгляд поэта направлен вдаль, словно он прислушивается к рокоту волн, волосы развеваются на ветру, в одной руке шляпа, которую ветром почти сворачивает, вторая ладонь поэта опирается на камень. И, по замыслу Айвазовского, он произносит морю прощальные строки: Прощай, свободная стихия! В последний раз передо мной Ты катишь волны голубые И блещешь гордою красой… ", 1877., нет данных., холст., масло., портрет., романтизм.," Всероссийский музей А. С. Пушкина, Санкт-Петербург, Россия."
3,Айвазовский Иван,Смотр Черноморского флота в 1849 году,https://opisanie-kartin.ru/ajvazovskij-ivan/smotr-chernomorskogo-flota-v-1849-godu/,  , 1886., 131 x 249 см., холст., масло., марина., романтизм.," Центральный военно-морской музей, Санкт-Петербург, Россия."
4,Айвазовский Иван,Русско-турецкий морской бой при Синопе 18 ноября 1853 года,https://opisanie-kartin.ru/ajvazovskij-ivan/russko-tureckij-morskoj-boj-pri-sinope/,  , 1853., 331 x 220 см., холст., масло., батализм., романтизм.," Центральный военно-морской музей, Санкт-Петербург, Россия."
5,Айвазовский Иван,Девятый вал,https://opisanie-kartin.ru/ajvazovskij-ivan/devyatyj-val/,". Коллекционер и меценат Третьяков пристально следил за творчеством Айвазовского, посещал его выставки и мастерскую в Феодосии. На картине изображено море, сильно волнующееся после недавней бури. Но не все еще закончено — должен придти легендарный девятый вал — апогей бурь и штормов, самая мощная и разрушительная волна. Несколько уцелевших после кораблекрушения обессилевших людей цепляются за обломок мачты затонувшего корабля. Солнце, озаряющее небеса, словно бы подбадривает их, дает шансы на спасение, но темная, почти черная вода хочет поглотить мореплавателей, как уже поглотило их корабль. Это произведение написано Айвазовским во время своего творческого подъема. После «Девятого вала», он написал целую серию картин, изображающих море во время шторма («Радуга», «Корабль среди бурного моря»). Но самой известной стала картина «Девятый вал», это произведение стало своего рода пропуском к широчайшему мировому признанию живописного таланта Айвазовского. ", 1850., 221 x 332 см., холст., масло., марина., романтизм.," Государственный Русский музей, Санкт-Петербург, Россия."
6,Айвазовский Иван,Неаполитанский залив в лунном свете,https://opisanie-kartin.ru/ajvazovskij-ivan/neapolitanskij-zaliv-v-lunnom-svete/,"  В этой работе художник не просто точно передает красоту и особенности природы, но и откровенно любуется ею. Картина Айвазовского «Неаполитанский залив в лунном свете» — одно из самых известных произведений итальянского периода художника. Зритель видит залив, объятый ночными сумерками и словно погруженный в сон. На глади воды золотится волшебный свет лунной дорожки. Где-то вдали таинственно вырисовываются очертания Везувия. Древние башни, увитые плющом, погружены в дремоту. В одном окне чуть теплится огонек. Все вокруг словно окутано легкой прозрачной дымкой. Торжественность панорамного вида не устраняет тонкую лиричность картины. ", 1842., 92 x 141 см., холст., масло., пейзаж., романтизм.," картинная галерея им. И.К.Айвазовского, Феодосия, Крым."
7,Айвазовский Иван,Чесменская битва ночью,https://opisanie-kartin.ru/ajvazovskij-ivan/chesmenskaya-bitva-nochyu/,. , 1848., 193 х 183 см., холст., масло., батализм., романтизм.," Картинная галерея им. К.И.Айвазовского, Феодосия, Крым."
8,Айвазовский Иван,Петр I при Красной горке,https://opisanie-kartin.ru/ajvazovskij-ivan/petr-1-pri-krasnoj-gorke/,", который добрался до берега с одним из матросов. Петр при помощи костра указывает путь кораблям в эту страшную ночь. Высокие ревущие волны с неистощимой яростью набросились на флотилию, темное грозовое небо и разъяренная морская стихия вступили в союз против человека. Но человек не растерялся. Этот человек — Пётр. Он осветил путь кораблям и теперь они так просто не сдадутся буре. Пусть ветер свистит и бешено рвет паруса, человек оказывается сильнее природы, его воля сломит ярость волн. Свет, зажженный Петром на берегу, воодушевил моряков, и они, воспрянув духом, продолжают бороться со стихией. ", 1846., 223 x 335 см., холст., масло., марина., романтизм.," Государственный Русский музей, Санкт-Петербург, Россия."
9,Айвазовский Иван,Рыбаки на берегу моря,https://opisanie-kartin.ru/ajvazovskij-ivan/rybaki-na-beregu-morya/,  , 1852.," 93,5 х 143 см.", холст., масло., марина., романтизм.," Национальная картинная галерея Армении, Ереван."
10,Айвазовский Иван,Большой рейд в Кронштадте,https://opisanie-kartin.ru/ajvazovskij-ivan/bolshoj-reid-v-kronshtadte/,"  «Большой рейд в Кронштадте» — одна из самых ранних работ Авазовского. На холсте изображены морской порт города Кронштадт, который располагается всего в 26 километрах от Санкт-Петербурга, прямо посреди Финского залива, и величественный военный парусник. Написать это потрясающее полотно Айвазовского побудили впечатления от поездки в летнее учебное плавание кораблей Балтийского флота по Финскому заливу, куда молодой художник отправился в 1836 году. Это полотно в этом же году было представлено на осенней выставке в Академии, а после ее окончания художника отметили как одного из лучших пейзажистов России, и все его работы получили высокую оценку специалистов. ", 1836.," 71,5 х 93 см.", холст., масло., марина., романтизм.," Государственный Русский музей, Санкт-Петербург, Россия."
11,Айвазовский Иван,Лунная ночь на Босфоре,https://opisanie-kartin.ru/ajvazovskij-ivan/lunnaya-noch-na-bosfore/,  , 1884., нет данных., холст., масло., городской пейзаж., романтизм., нет данных.
12,Айвазовский Иван,В шторм,https://opisanie-kartin.ru/ajvazovskij-ivan/v-shtorm/,  , 1872., 72 x 92 см., холст., масло., марина., романтизм., нет данных.
13,Айвазовский Иван,Портрет Лорис-Меликова,https://opisanie-kartin.ru/ajvazovskij-ivan/portret-loris-melikova/,  , 1888., нет данных., холст., масло., портрет., романтизм., нет данных..
14,Айвазовский Иван,Пушкин на берегу Черного моря,https://opisanie-kartin.ru/ajvazovskij-ivan/pushkin-na-beregu-chernogo-morya/,  , 1887., 212 x 314 см., холст., масло., пейзаж., романтизм.," Художественный музей им. В.В. Верещагина, Николаев, Украина."
15,Айвазовский Иван,Вид Тифлиса от Сейд-Абаза,https://opisanie-kartin.ru/ajvazovskij-ivan/vid-tiflisa-ot-seid-abaza/,  , 1868., 36 x 47 см., холст., масло., городской пейзаж., романтизм., нет данных.
16,Айвазовский Иван,Бриг «Меркурий,https://opisanie-kartin.ru/ajvazovskij-ivan/brig-merkurij-atakovannyj-dvumya-tureckimi-korablyami/,  , 1892., 339 x 212 см., холст., масло., марина., романтизм., нет данных.
17,Айвазовский Иван,Радуга,https://opisanie-kartin.ru/ajvazovskij-ivan/raduga/,"  К 1973 году среди критиков появились мнения о том, что Айвазовский устарел, вышел в тираж, как сказали бы в наше время. В ответ на это, великий маринист написал картину «Радуга», которая не только доказала всем обратное, но и стала поворотной в его творчестве. На первый взгляд, на картине запечатлен стандартный для Айвазовского сюжет: беснующееся море, гибель корабля. Но, используя отточенные приемы и техники, художник модернизирует их, хорошо это видно при анализе колорита картины. На полотне изображен парусник после кораблекрушения, силуэт его сильно размыт брызгами и водной пылью, поднятыми сильным ветром. Из-за этого так же сильно размыты очертания береговых скал. Небо практически слилось с бушующим морем. Смелые яркие цветовые решения, как на полотне «Девятый вал», на этой картине становятся более сдержанными, хорошо отточенными. Цветовые оттенки и переходы отличаются особой изысканностью. Буря уже почти закончилась, и солнечный свет, пробивающийся через рваные тучи, создает едва видную радугу, предвещающую скорое спасение. Несмотря на трагический сюжет, настроение картины позитивное. Видно, что смертный бой морской стихии и человека окончился победой последнего. И радуга здесь используется как символ спасения, как луч надежды. ", 1848., 102 x 132 см., холст., масло., марина., романтизм.," Государственная Третьяковская галерея, Москва, Россия."
18,Айвазовский Иван,Вид Леандровой башни в Константинополе,https://opisanie-kartin.ru/ajvazovskij-ivan/vid-leandrovoj-bashni-v-konstantinopole/,  , 1848., 58 x 45 см., холст., масло., марина., романтизм.," Государственная Третьяковская галерея, Москва, Россия."
19,Айвазовский Иван,Босфор в лунную ночь,https://opisanie-kartin.ru/ajvazovskij-ivan/bosfor-v-lunnuyu-noch/,"  Все творчество и вся жизнь Ивана Айвазовского была связана с морем. Обладая феноменальной зрительной памятью, он смог передать на своих картинах даже мельчайшие детали с фотографической точностью и изобразить стихию воды так достоверно, как никто до него. На картине «Босфор в лунную ночь» художник изобразил водную гладь пролива Босфор во время полнолуния. Работа наполнена спокойствием и безмятежностью, максимальная реалистичность изображения приковывает взгляд, от нее невозможно оторваться. Среди спящих кораблей со спущенными парусами бесшумно скользят небольшие лодки с рыбаками. Полная луна на безоблачном небе дает возможность зрителю рассмотреть не только близлежащий причал с кораблями возле него, но и горы, в отдалении окружающие пролив. Поистине поражает мастерство художника, способного настолько точно передать водную гладь, освещенную ночным светилом. Способность Айвазовского уловить и запечатлеть на холсте невесомое дыхание и едва заметное движение морского пейзажа, делает его, пожалуй, величайшим художником-маринистом. ", 1874., 73 х 94 см., холст., масло., марина., романтизм., нет данных.
20,Айвазовский Иван,Автопортрет,https://opisanie-kartin.ru/ajvazovskij-ivan/avtoportret-2/,  , 1892., нет данных., нет данных., нет данных., автопортрет., романтизм., нет данных.
21,Айвазовский Иван,Георгиевский монастырь,https://opisanie-kartin.ru/ajvazovskij-ivan/georgievskij-monastyr/,  , 1846., 123 x 193 см., холст., масло., пейзаж., романтизм.," Феодосийская картинная галерея, Крым, Россия."
22,Айвазовский Иван,Вечер на море,https://opisanie-kartin.ru/ajvazovskij-ivan/vecher-na-more/,"  И жизнь, и творчество Ивана Айвазовского были неразрывно связаны с морем. Поэтому главный герой практически всех его картин — стихия воды. С ростом Айвазовского как художника можно заметить и перемены в его творчестве — ранние его работы полны динамики, буйства стихии, но с годами штормы и бури утихают, картины становятся более реалистичными. Написанная в 1871 году картина «Вечер на море» относится к позднему, зрелому периоду творчества Айвазовского. Море полностью спокойно, изображено очень реалистично, и не представляет никакой опасности для людей на берегу — один из них решил окунуться в его прохладные спокойные воды. Композиция картины оригинальна — выбранный художником угол зрения, с одной стороны, показывает бесконечную водную гладь, а с другой создает замкнутость пространства. Художник добился этого ограничив водную поверхность густыми облаками на горизонте и береговой линией на переднем плане. Небольшой фрагмент спокойного моря, изображенный на картине, легко освещен лучами вечернего солнца. Настроение картины Айвазовского «Вечер на море» бесконфликтно, уравновешено, полно спокойствия и гармонии. Работы выполнена очень реалистично, не имеет ярких красочных акцентов и цветовых пятен, художник использовал светлые краски. Такой стиль написания картин характерен для позднего периода творчества Ивана Айвазовского. ", 1871., нет данных., нет данных., нет данных., марина., романтизм., нет данных.
