,Автор,Название картины,Ссылка на картину,Описание,Год,Размер,Материал,Техника,Жанр,Стиль,Галерея
238,Венецианов Алексей,Крестьянка с васильками,https://opisanie-kartin.ru/venecianov-aleksey/krestyanka-s-vasilkami/,"  «Крестьянка с васильками», написанная Венециановым в 1830 году — лирически проникновенная картина. Характер любой композиции этого живописца всегда выходит за пределы простого и обыденного воспроизведения натуры. Венецианов с явным сочувствием пишет образ молодой крестьянки. Чуть-чуть опущенные плечи говорят об усталости, руки спокойно лежат на охапке пушистых васильков. В портрете чувствуется уважение и искренняя симпатия живописца к простым людям. Венецианов утверждал: «Художник объемлет красоту и учится выражать страсти не органическим чувством зрения, но чувством высшим, духовным, тем чувством, на которое природа нещедра бывает и одаряет только немногих своих любимцев, и то частицей». Крестьянка на этой картине в изображении Венецианова преисполнена душевной красоты и благородства. Смотря на это полотно, как будто физически ощущаешь моральную чистоту и внутреннюю целостность ее натуры. Художник избрал «простую натуру». Его героиня не обладает античной красотой, но автору удалось добиться абсолютной гармонии идеально-прекрасного и национально-характерного. ", 1830.," 66,7 х 52 см.", холст., масло., портрет., реализм.," Государственный Русский музей, Санкт-Петербург, Россия."
239,Венецианов Алексей,Встреча у колодца,https://opisanie-kartin.ru/venecianov-aleksey/vstrecha-u-kolodca/,  , 1843., 66 х 50 см., холст., масло., жанровая живопись., реализм.," Азербайджанский государственный музей искусств, Баку, Азербайджан."
240,Венецианов Алексей,Крестьянские дети в поле,https://opisanie-kartin.ru/venecianov-aleksey/krestyanskie-deti-v-pole/,  , 1810-е.," 38,5 х 30 см.", холст., масло., портрет., реализм.," Государственный Русский музей, Санкт-Петербург, Россия."
241,Венецианов Алексей,Девушка в платке,https://opisanie-kartin.ru/venecianov-aleksey/devushka-v-platke/,  , 1830-е.," 38 х 27,5 см.", холст., масло., портрет., реализм.," Государственный Русский музей, Санкт-Петербург, Россия."
242,Венецианов Алексей,Жнецы,https://opisanie-kartin.ru/venecianov-aleksey/zhnecy/,"  Картина Алексея Венецианова «Жнецы», написанная на холсте небольшого размера, пропитана атмосферой завороженного созерцания. Затаив дыхание, восхищённо и внимательно деревенский паренек рассматривает двух красивых бабочек, присевших на руку его матери. А она чуть-чуть наклонив голову к своему сыну, глядит в сторону утомлённо и спокойно. На этом полотне изображены Захарка, герой нескольких полотен Алексея Венецианова, и его мать Анна Степанова. Кстати, именно Захарку художник сделает прототипом одной из церковных икон, написанных им для Покровской церкви. Это икона и сейчас находится в церкви села Покровское. Композиция картины «Жнецы» лаконична: полуфигуры героев крупные и приближены к самой раме, а задний фон — сплошная стена из колосьев. Объемно выписаны лица и руки персонажей, очертания их голов словно повторяются разомкнутыми окружностями серпов. Густыми мазками выписана грубая ткань одежды Анны Степановой: сарафан, белая рубаха, желтоватый платок на голове, подчеркнуто скромные украшения — ожерелье и колечко. Художник точно подмечает разный тон кожи женского запястья и обветренных рук подростка, правильно прописывает светотень на лицах своих героев. С очевидной искренней симпатией он пишет любознательного Захарку, изображает застенчивую ласку и теплоту на материнском лице. В картине «Жнецы» Венецианов делает так называемую картину-обманку — он изображает бабочек настолько иллюзорно, что с первого взгляда на работу и не понять, нарисованные они или, может быть, сидят на самом деле на поверхности холста. ", 1820.," 66,7 х 52 см..", холст., масло., портрет., реализм.," Государственный Русский музей, Санкт-Петербург, Россия."
243,Венецианов Алексей,Купальщицы,https://opisanie-kartin.ru/venecianov-aleksey/kupalsshicy-2/,  , 1829.," 52,5 х 36,5 см.", холст., масло., ню., реализм.," Государственная Третьяковская галерея, Москва, Россия."
244,Венецианов Алексей,Жатва,https://opisanie-kartin.ru/venecianov-aleksey/zhatva/,"  Пейзаж на картине Алексея Венецианова «Жатва» задает торжественную тональность всему полотну. Чтобы не оставить главную героиню во власти обыденного мотива, полноправно и естественно сопоставить ее с землей и небом, художник прибегает к специальному приему: сажает крестьянку на высокий помост, будто возвышает ее над будничной повседневностью. Теперь искомое найдено: соотношение огромного неба и бескрайней земли, соотнесение жизни человека и бытия природы обрело равновесие. Неразрывная слитность воплощена с редкой пластической обобщенностью. Эта обобщенность рождает ощущение подлинной монументальности. Когда смотришь на репродукцию картины, невозможно поверить, что ее размеры составляют всего-навсего шестьдесят см по высоте и менее пятидесяти по ширине. Своей сложной сотканностью картина ясно показывает, как понимал сам Венецианов на деле провозглашенный им принцип «а-ля натюрель». Для него это не копия, а живая правда действительности, правда воплощения идеи, а не факта. При всём желании и стремлении к натуральности, художник понял, что имитация красок природы невозможна. Художник не в силах передать все существующее в природе многообразие цветов, увеличенное к тому же работой света. Но Венецианов досконально изучил возможности собственной, венециановской палитры. Живописец ставит перед собой главную задачу — на свой индивидуальный язык перевести реальное многообразие красок природы, увидеть точный цвет натуры и внедрить его в живописный язык. ", 1820., 60 х 48 см., холст., масло., пейзаж., реализм.," Государственная Третьяковская галерея, Москва, Россия."
245,Верещагин Василий,Ночной привал великой армии,https://opisanie-kartin.ru/veresshagin-vasilij/nochnoj-prival-velikoj-armii/,  , 1897., нет данных., холст., масло., историческая живопись., реализм.," Государственный Исторический музей, Москва, Российская Федерация."
246,Верещагин Василий,После удачи,https://opisanie-kartin.ru/veresshagin-vasilij/posle-udachi/,  , 1868., 47 х 39 см., холст., масло., жанровая живопись., реализм.," Государственный Русский музей, Санкт-Петербург, Российская Федерация."
247,Верещагин Василий,Наполеон на Бородинских высотах,https://opisanie-kartin.ru/veresshagin-vasilij/napoleon-na-borodinskih-vysotah/,"  Около 20 полотен В. В. Верещагин посвятил Отечественной войне 1812 года. Над этими картинами художник работал в период с 1887 по 1901 год. Живописец стремился, с одной стороны, показать великий патриотический дух русской армии, ее героизм в борьбе с французами, а с другой – развенчать Наполеона, снять его с пьедестала «героя». В серии картин, посвященных Отечественной войне 1812 года, выделяется полотно «Наполеон на Бородинских высотах», написанное в 1897 году. На полотне – изображение Бородинского сражения 26 августа 1812 года. В процессе битвы Наполеон почти все время находился в своей ставке у Шевардина. Художник изобразил императора сидящим на походном стуле. Нелегко у него на душе, он кажется очень сосредоточенным и погруженным в себя. За Наполеоном – свита и штаб, а затем — гвардия в парадной форме. Его маршалы напряженно всматриваются вдаль – туда, где происходит сражение. Некоторые гвардейцы увлеченно обсуждают что-то постороннее. Тщательно, с документальной точностью, выписаны художником военные мундиры приближенных императора, их оружие. Известно, что Наполеона упрекают в том, что в Бородинском сражении он был недостаточно энергичен и решителен. Действительно, в этом бою он не подвергал себя опасности, не рисковал сам и не решился рискнуть своей гвардией – то есть вел себя больше как император, нежели как генерал. Победитель в Бородинском сражении так и не был окончательно назван, потери обеих сторон были невероятно велики. Сам Наполеон говорил, что под Бородином «выказано наиболее доблести и одержан наименьший успех». Историческая эпопея Верещагина, посвященная Отечественной войне 1812 года, в том числе и полотно «Наполеон на Бородинских высотах», не только знакомят нас с историческими событиями, но и заставляют задуматься о трагедии огромного количества всех втянутых в войну людей – и русских, и французов.  ", 1897., 107 x 157 см., холст., масло., историческая живопись., реализм.," Государственный Исторический музей, Москва, Россия."
248,Верещагин Василий,Мавзолей Шах-и-Зинда,https://opisanie-kartin.ru/veresshagin-vasilij/mavzolej-shah-i-zinda/,  , 1870.," 26,8 х 36,6 см.", холст., масло., городской пейзаж., реализм.," Государственная Третьяковская галерея, Москва, Российская Федерация."
249,Верещагин Василий,Апофеоз войны,https://opisanie-kartin.ru/veresshagin-vasilij/apofeoz-voiny/,"  Эта картина известного баталиста Василия Верещагина известна не только в России, но и за её пределами. И в самом деле, на картине «Апофеоз войны» художник очень точно показал всю суть войны: смерть и страдание. На картине живописец изобразил гору человеческих черепов посреди безжизненной равнины, обезображенной войной. Война отравила и испепелила всё: людей, землю, деревья, воздух. Повсюду на картине смерть оставила свой след: на чёрных стволах деревьев нет ни одной живой ветки, на земле не растёт ни одной живой травинки, художник не изобразил ни одной живой души, кроме воронов, которые тоже являются символом смерти. На востоке существовал такой способ устрашения противника — складывать такие пирамиды из голов поверженных врагов или казненных за трусость воинов. Такие пирамиды естественно вызывали у людей отвращение и ужас. Художник для изображения ужасов войны использует черепа вместо голов, чтобы немного смягчить изображение этого страшного обычая. Суровая, жёсткая картина. Но в то же время сильная своей правдой, показанными жертвами и страданиями людей, перемалываемых в жерновах чужой войны. Картину «Апофеоз войны» Верещагин посвятил всем великим завоевателям настоящих времён, прошлого и будущего, пытаясь показать, что обратной стороной их подвигов является смерть ни в чем не повинных людей. ", 1871., 127 x 197 см., холст., масло., пейзаж., реализм.," Государственная Третьяковская галерея, Москва, Российская Федерация."
250,Верещагин Василий,Триумф,https://opisanie-kartin.ru/veresshagin-vasilij/triumf/,  , 1872., нет данных., холст., масло., городской пейзаж., реализм.," Государственная Третьяковская галерея, Москва, Российская Федерация."
251,Верещагин Василий,У крепостной стены. «Пусть войдут!,https://opisanie-kartin.ru/veresshagin-vasilij/u-krepostnoj-steny-pust-voydut/,  , 1871.," 95 х 160,5 см.", холст., масло., батализм., реализм.," Государственная Третьяковская галерея, Москва, Российская Федерация."
252,Вермеер Ян,Кружевница,https://opisanie-kartin.ru/vermeer-yan/kruzhevnica-2/,  , 1671., 24 x 21 см., холст., масло., жанровая живопись., барокко.," Лувр, Париж, Франция."
253,Вермеер Ян,Любовное письмо,https://opisanie-kartin.ru/vermeer-yan/lyubovnoe-pismo/,  , 1669.," 38,5 x 44 см.", холст., масло., жанровая живопись., барокко.," Рейксмюзеум, Амстердам, Нидерланды."
254,Вермеер Ян,Молочница,https://opisanie-kartin.ru/vermeer-yan/molochnica/,  , 1660.," 41 x 45,5 см.", холст., масло., жанровая живопись., барокко.," Рейксмюзеум, Амстердам, Нидерланды."
255,Вермеер Ян,Девушка с жемчужной сережкой,https://opisanie-kartin.ru/vermeer-yan/devushka-s-zhemchuzhnoj-serezhkoj/,  , 1665.," 46,5 x 40 см.", холст., масло., портрет., барокко.," Королевская галерея Маурицхёйс, Гаага, Нидерланды."
256,Волков Ефим,Октябрь,https://opisanie-kartin.ru/volkov-efim/oktyabr/,. , 1883.," 38,2 х 55 см.", холст., масло., пейзаж., реализм.," Государственная Третьяковская галерея, Москва, Россия."
257,Волков Ефим,Морской туман,https://opisanie-kartin.ru/volkov-efim/morskoj-tuman/,  , 1895., нет данных., холст., масло., марина., реализм.," Новгородский государственный объединенный музей-заповедник, Новгород, Россия."
258,Волков Ефим,Украинский пейзаж,https://opisanie-kartin.ru/volkov-efim/ukrainskij-pejzazh/,  , нет данных., нет данных., холст., масло., пейзаж., реализм., частная коллекция.
259,Волков Ефим,Море,https://opisanie-kartin.ru/volkov-efim/more/,"  Картина Ефима Волкова «Море» — это морской пейзаж, написанный в реалистичной манере. Художник во всех своих произведениях стремился изображать природу максимально близко к реальности, но, в отличие от работ, например, Ивана Шишкина, кроме реализма в них чувствуется определенный романтизм и загадочность. На картине изображено волнующееся море, пенные волны которого одна за одной набегают на песчаный берег. Маленькая деревянная лодочка на берегу, кажется, не в силах противостоять стихии, ее вот-вот унесет в открытое море. Мутная зеленоватая вода поднимает на поверхность водоросли и песок. В верхней части картины «Море» Ефим Волков изобразил серое хмурое небо. Выполненное в мрачной цветовой гамме, оно показывает нам, что скоро начнется гроза и шторм. Работа выполнена в оригинальной манере — художник использовал достаточно крупные мазки, отчего она лучше воспринимается на некотором расстоянии — кажется, что море становится совсем живым, создается эффект присутствия. ", нет данных., нет данных., холст., масло., марина., реализм.," Липецкий областной краеведческий музей, Липецк, Россия."
260,Волков Ефим,В лесу по весне,https://opisanie-kartin.ru/volkov-efim/v-lesu-po-vesne/,  , 1877., 53 x 89 см., холст., масло., пейзаж., реализм.," Государственный музей изобразительных искусств Республики Татарстан, Казань, Россия."
261,Волков Ефим,Гулянье в летнем саду,https://opisanie-kartin.ru/volkov-efim/gulyanje-v-letnem-sadu/,  , 1890-е., нет данных., холст., масло., жанровая живопись., реализм.," Новгородский государственный объединенный музей-заповедник, Новгород, Россия."
262,Волков Ефим,Болото осенью,https://opisanie-kartin.ru/volkov-efim/boloto-osenyu/,  , 1871., 42 х 80 см., холст., масло., пейзаж., реализм.," Государственная Третьяковская галерея, Москва, Россия."
263,Врубель Михаил,Демон сидящий,https://opisanie-kartin.ru/vrubel-mihail/sidyaschij-demon/,"  Все полотна Михаила Врубеля пропитаны тайной и сказкой, особенно его изображения демонов. В 1891 году вышло юбилейное переиздание сочинений Лермонтова, к которому Врубель исполнил 30 иллюстраций. В основном это были иллюстрации к поэме «Демон». А сюжет картины «Демон сидящий» был задуман в Москве после прочтения этой поэмы Врубелем. Главный персонаж картины Врубеля «Демон сидящий» — существо, сидящее на вершине горы. Его сильное мускулистое тело напряжено, но лицо, наоборот, спокойно и даже несколько меланхолично. Это показывает двойственность образа демона — с одной стороны крепкое, словно гранитное тело, а с другой — ранимая, трепетная душа. Образ демона олицетворяет дух человека, его внутреннюю борьбу и душевные терзания. На картине изображен сидящий в печальной позе демон. Вокруг него горы, алеет закат. Картина написана в оригинальном стиле Врубеля — она больше напоминает витраж или панно. Плоские мазки мастихином обеспечили эффект кристаллических граней. Это изображение демона — самое известное из демонов Врубеля. ", 1890.," 212,5 x 115 см.", холст., масло., литературная живопись., символизм.," Государственная Третьяковская галерея, Москва, Россия."
