,Автор,Название картины,Ссылка на картину,Описание,Год,Размер,Материал,Техника,Жанр,Стиль,Галерея
489,Кустодиев Борис,Купчихи,https://opisanie-kartin.ru/kustodiev-boris/kupchihi/,"  В конце 1911 года, находясь в Швейцарии в клинике, Борис Кустодиев откликнулся на просьбу коллекционера Федора Нотгафта написать для него картину на русскую тему по своему усмотрению. Этой картиной стали «Купчихи». Кустодиев завершил работу в 1912 году, вложив в нее и воспоминания о России, и любовь к «своему, русскому», и годами накопленный опыт мастерства. «Купчихи» стали одним из лучших созданий Кустодиева и открыли обширную серию его образов купчих, купцов, купеческого быта. В этих работах были сплавлены черты истории и современности, реальность и идеализирующая ее фантазия, «русский вкус» и навыки художника, обладающего широчайшей культурной основой, национальной и западноевропейской. Кустодиев представил на переднем плане картины беседу четырех купчих, нарядных молодых женщин, пышнотелых, белокожих, румяных, полных горделивого достоинства. Фоном для их группы является типичная для русской провинции церковная и гражданская архитектура, по бокам, словно кулисы в театре, изображены края зданий с вывесками, слева — также корзины с яблоками, выставленными на продажу, и рекламный золотящийся крендель на кронштейне. На одной вывеске видна пирамида из овощей и фруктов, увенчанная привозным ананасом, на другой — надпись «Табакъ» и изображение восточной красавицы с пальмой и звездным небом. В цветистую, театрализованную картину, передающую ощущение привычного, размеренного уклада провинциальной жизни, покоя, достатка, здоровья, уверенности молодых купчих в себе, Кустодиев внес ноты мягкой иронии. Образ, созданный им, на редкость целен, его героини неотделимы от окружающей среды и ни в какой иной обстановке не могли бы существовать так естественно. Все вместе — и яркое зрелище, и воплощение своеобразия русской жизни. ", 1912.," 108 x 81,5 см.", холст., масло., жанровая живопись., модерн.," Государственный музей русского искусства, Киев, Украина."
490,Кустодиев Борис,Московский трактир,https://opisanie-kartin.ru/kustodiev-boris/moskovskij-traktir/,"  Зрелый стиль Кустодиева ярко проявился в его картине 1916 года «Московский трактир». Известно, что в числе характерных примет московского быта издавна была любовь к чаепитию. Еще в 1848 году в одном из своих очерков московской жизни Иван Кокорев писал: «Кто знает Москву не понаслышке, не по беглой наглядке, тот согласится, что чай — пятая стихия ее жителей и что, не будь этой земной амврозии, в быте москвичей произошел бы коренной переворот». Кустодиева привлекла возможность представить зрителям картину одной из разновидностей московской традиции. Будучи в Москве, художник внимательно присматривался к обстановке трактира, куда в морозы по сложившемуся обычаю приходили отдохнуть и попить чаю извозчики-лихачи, старообрядцы, соблюдавшие неторопливый, чинный ритуал чаепития. Образ, созданный Кустодиевым, — плод сочетания жизненных наблюдений и богатства фантазии, на основе которой происходит «разрастание» или «сгущение» качеств натуры. Художник стремился к острой характерности в трактовке интерьера, типов, костюмов, в передаче поведения людей. В том-то и состоит одна из главных задач и вместе с тем трудностей в его работе, чтобы при всей заведомой «построенности», условности изображенного, у зрителя возникло ощущение полной достоверности картины, нерасторжимости жизненной и художественной правды. В основу цветового строя полотна Кустодиев положил красный цвет, чтобы условно передать атмосферу жара трактирного чаепития и в то же время вызвать ассоциации при изображении народных типов лиц с краснофонными новгородскими иконами. На переднем плане, как на сцене театра, художник представил под иконой Николая-угодника кружок лихачей разного возраста в своих типичных синих армяках, подпоясанных цветными кушаками. Они истово прихлебывают чай с блюдечек, а самый молодой из них, грамотный, читает Русское слово — популярнейшую и рассчитанную «на народ» московскую газету сытинского издательства. За симметрично расположенными арочными сводами, словно за боковыми кулисами, контрастно сопоставлены еще два интерьера — заставленное расписными чайниками и завешенное нарядными подносами тесное помещение с закусками на стойке и всевидящим хозяином трактира у граммофона и помещение для избранных посетителей с «романтическим вкусом». Трактирная романтика — это пальма в кадке, морской лунный пейзаж на стене, певчие птицы в клетках. Беготня расторопных половых-ярославцев подчеркивает позу их товарища, задремавшего справа у стола от временного безделья, контрастирует с неспешными движениями пьющих чай. Создавая сплав высокой профессиональной культуры живописи с традициями лубка, понятого в самом широком смысле, как изобразительное фольклорное начало, Кустодиев в то же время сближал станковую живопись с элементами театральной, чтобы добиться зрелищности образа, его содержательной «густоты», сконцентрированности. Новой в его искусстве стала намечающаяся тенденция использовать приемы академического наследия, прежде всего симметричность, уравновешенность композиции. Его картина наглядно раскрывает целый пласт московского, а через него — и русского традиционного быта. ", 1916.," 99,3 х 129,3 см.", холст., масло., жанровая живопись., модерн.," Государственная Третьяковская галерея, Москва, Россия."
491,Кустодиев Борис,Купчиха и домовой,https://opisanie-kartin.ru/kustodiev-boris/kupchiha-i-domovij/,  , 1922.," 12,5 х 22,8 см.", дерево., масло., ню., модерн., частное собрание.
492,Кустодиев Борис,Купчиха,https://opisanie-kartin.ru/kustodiev-boris/kupchiha/," века вне столичной и дворянской среды девушки на выданье надевали в праздник по несколько юбок, чтобы казаться толще. Худобу на Руси издревле считали женским изъяном, полнота воспринималась как здоровье, а с ним и способность женщины рожать детей, выполнять тяжелую работу. Полнота вошла, таким образом, в народные представления о красоте, и именно этот идеал, со всей его наивностью, стремился воплотить художник. ", 1915., 204 х 109 см., холст., масло., портрет., модерн.," Государственный Русский музей, Санкт-Петербург, Россия."
493,Кустодиев Борис,Чтение манифеста,https://opisanie-kartin.ru/kustodiev-boris/chtenie-manifesta/,  , 1909., нет данных., холст., масло., историческая живопись., реализм.," Нижегородский художественный музей, Нижний Новгород, Россия."
494,Кустодиев Борис,Вербный торг у Спасских ворот,https://opisanie-kartin.ru/kustodiev-boris/verbnyj-torg-u-spasskih-vorot/,  , 1917.," 89 x 70,5 см.", холст., масло., жанровая живопись., модерн.," Нижегородский государственный художественный музей, Нижний Новгород, Россия."
495,Кустодиев Борис,Земская школа в Московской Руси,https://opisanie-kartin.ru/kustodiev-boris/zemskaya-shkola-v-moskovskoj-rusi/,  , 1907., нет данных., картон., темпера., жанровая живопись., реализм.," Государственный Русский музей, Санкт-Петербург, Россия."
496,Кустодиев Борис,Красавица,https://opisanie-kartin.ru/kustodiev-boris/krasavica/,"  В 1915 году Кустодиев завершил окончательное формирование своего стиля картиной «Красавица». Он раскрыл здесь традиционные вкусы в образе, окрашенном одновременно и любованием, и эротикой, и иронией, изобразив не просто полную, а на сей раз особенно пышнотелую женщину. Полусидя, полулежа на постели, она, подобно Венере Урбинской Тициана, спокойно взирает на то, как воспринимает ее зритель. Эта обезоруживающая откровенность помогает перевести образ из почти двусмысленной ситуации в сферу эстетического. Кустодиев с наслаждением передал сходство нежной и гладкой розовой кожи своей модели с цветом и гладкостью атласного одеяла, обшитого кружевами, сопоставляя крупные округлые формы женского тела с мягкостью пуховых подушек и складок одеяла. Вся атмосфера алькова с обоями на стене, украшенным и розанами, с расписной нарядной нижней стенкой постели, мягким пуфиком под ногой женщины, с фигурками (в другом варианте — цветами и украшениями) на комоде, вызывает ощущение чувственно-сонной, сладкой, расслабляюще спокойной жизни, олицетворением которой являются кустодиевская красавица и привычная ей среда. Основой для картины Кустодиева «Красавица» послужил рисунок карандашом и сангиной, сделанный с натуры. Кстати, с натуры написано и пуховое одеяло — по воспоминаниям детей художника, это одеяло подарила супруга живописца в день его рождения. Кустодиев работал над этой картиной ежедневно и постоянно дополнял сюжет новыми деталями — например, в сюжет картины он вписал три гипсовые фигурки, купленные им на Сытном рынке, а также повторил узор старинной стенки сундука с росписью по железу — на черном фоне красные розы в вазе. Вот что писал об этой работе критик Володарский: «Для меня главное в картине — цвет. Красавица откинула атласное одеяло, обнажив свое бело-розовое, как «зефир» тело. Это — одна из тех картин, которую обязательно надо видеть своими глазами». Считается, что картина «Красавица» стала своеобразным итогом исканий собственного стиля Кустодиева, начатых еще в 1912 году. ", 1915., 141 х 185 см., холст.," масло, пастель.", ню., модерн.," Государственная Третьяковская галерея, Москва, Россия."
497,Кустодиев Борис,Вступление. 1905 год. Москва,https://opisanie-kartin.ru/kustodiev-boris/vstuplenie/,"  События 1905 года не могли пройти мимо Кустодиева, и переживания его тонко чувствующей души выразились в работе «Вступление», написанной в Москве в 1905 году. В это время художник активно сотрудничал с революционно настроенными журналами, такими как «Жупел» — это это одно из самых известных периодических изданий начала 20 века, — а после его закрытия — с журналом «Адская почта», сатирическим ежемесячным журналом, издававшимся в Петербурге. Кустодиев помещал в них острые, злые карикатуры на царских чиновников, рисовал иллюстрации, в том числе поместил свою работу «Вступление». Художник, который остро переживал поражение революции, в аллегорической форме рассказывает о «Кровавом воскресенье» и жестоком подавлении рабочего восстания в 1905 году. На фоне тревожного, пылающего красного неба мы видим холодные серые дома, солдат, стреляющих в демонстрантов, а над всем этим — смерть, которая собирает умерших, не глядя на их убеждения. ", 1905., 26 х 26 см., бумага.," тушь, акварель.", иллюстрация., модерн.," Государственная Третьяковская галерея, Москва, Россия."
498,Кустодиев Борис,Большевик,https://opisanie-kartin.ru/kustodiev-boris/bolshevik/,"  Через три года после Февральской революции и создания картины «27 февраля 1917 года», Борис Кустодиев, уже прикованный к постели и инвалидному креслу, пишет картину «Большевик», в которой обратился не к непосредственным впечатлениям, как в феврале 1917 года, а к синтезу, осмыслению главного, что связалось у него с понятием «большевик». Это и Октябрьская революция, и голод в Петрограде с осени 1918 года, и Гражданская война, которая еще не кончилась, но в которой уже раз биты Колчак, Деникин, Юденич и наметился явный перелом в пользу «красных». Кустодиев обыграл само слово «большевик», которое в народе нередко пытались наивно объяснить как что-то «большое», сильное. Картина откровенно строится с опорой на лубочное начало. В ярком солнечном свете конца зимы, как на масленицу, по городу шагает могучий великан, гигант в солдатских сапогах и городском шарфе, с яростно насупленными бровями и красным знаменем в руках. Оно вьется над домами бесконечной алой лентой, и всюду, где оно появляется, улицы заполняют сплошные потоки пришедшего в движение вооруженного народа — солдат и матросов, кто-то за кем-то крадется с винтовкой вдоль стены, где-то идет митинг с оратором, выступающим перед солдатами с автомобиля. Для картины характерна атмосфера фантастической реальности, своеобразного «лубочного сюрреализма». Экспрессию усиливает резкое сочетание разных ракурсов — снизу на гиганта, что его монументализирует, сверху — на толпу у его ног. Композиция странно перекликается с изображением скелета в городе в 1905 году, но здесь перед шагающей фигурой вырастает препятствие — церковь с синим куполом, украшенным золотыми звездами, и остается неясным, обойдет ее гигант или сметет со своего пути. Остановить его невозможно. В этом образе символика-аллегорического характера Кустодиев выявил стихийную силу революции, массовость всего, что с ней связано, выразил смешанное чувство и невольного восхищения мощью, и страха перед грубой силой. Иначе передан солнечный городской пейзаж, особенно его дали, — с любованием его мирной поэтической красотой. ", 1920., 101 x 141 см., холст., масло., аллегория., модерн.," Государственная Третьяковская галерея, Москва, Россия."
499,Левитан Исаак,Мостик. Саввинская слобода,https://opisanie-kartin.ru/levitan-isaak/mostik-savvinskaya-sloboda/,"  Картина «Мостик. Саввинская слобода» написана И. Левитаном в 1884 году. Это удивительно лиричный пейзаж с богатым внутренним содержанием. Невзрачный мотив деревенских задворок рука великого мастера превратила в настоящую лирическую новеллу. На переднем плане картины мы видим простой бревенчатый мостик через небольшой журчащий ручеек, убегающий куда-то вдаль. За заднем плане — небольшие деревенские домики, дрова, в беспорядке разбросанные вокруг. Видно, работник отлучился куда-то ненадолго. Яркий солнечный день, все вокруг утопает в молодой пышной зелени. Сам воздух – светящийся, мягкий. Мостик отбрасывает тень на окружающую зелень, на ручеек, и все вокруг переливается в лучах яркого солнечного света. Казалось бы, обычный мостик, обычные дрова – а сколько в них красок, сколько поэзии! Пейзаж «Мостик. Саввинская слобода» словно насквозь пронизан солнечным светом. В этом произведении Левитан добивается необычной звучности цвета, особого сочетания красок и особенной цветопередачи. Эта солнечность, лучезарность, прозрачность воздуха придают обыкновенному деревенскому пейзажу особое поэтическое настроение, лирическое обаяние и одухотворенность. Глядя на полотно, мы вместе с художником восхищаемся гармонией природы, радующейся весеннему обновлению, и учимся понимать ее душу. ", 1884., 25 x 29 см., холст., масло., пейзаж, реализм.," Государственная Третьяковская галерея, Москва, Россия."
