,Автор,Название картины,Ссылка на картину,Описание,Год,Размер,Материал,Техника,Жанр,Стиль,Галерея
686,Пикассо Пабло,Авиньонские девицы,https://opisanie-kartin.ru/pikasso-pablo/avinyonskie-devicy/,"  Полотно было написано в 1907 году и ознаменовало собой новый творческий этап в жизни Пикассо — кубизм. История создания картины гласит, что сюжет навеян кварталом Авиньон в Барселоне, в котором располагался публичный дом. Задумывая произведение, художник сделал несколько эскизов, основные их которых — соблазнительная сцена в борделе, но в процессе работы остановился на выполнении пяти обнаженных фигур и натюрморта. Эта картина взорвала представление о живописи в обывательском понимании этого слова. Шокировала публику, которая знала Пикассо, и которому вновь удалось добиться ошеломляющего эффекта посредством новаторства. Тут отрицаются и органическая целостность человеческого тела, и его пропорции. Изображения создают эффект трехмерности, а грани, клинья, углы затенены таким образом, что являют собой картину некоего отвердевшего пространства, или прозрачных тел, и все это целостно, непрерывно, обтекаемо… Мастер представил зрителям неких чудовищ с масками вместо лиц, едва обозначенной половой принадлежностью, пугающими созданиями дикой природы, агрессивной эротики, возбуждающей экспрессии. Изображенные фигуры выполнены по-разному необычно. Слева силуэт имеет что-то общее с ассирийскими и египетскими рельефами. Женские фигуры в центральной части полотна — это роспись романских храмов Каталонии, с присущим ей мистическим лиризмом. Лица правых фигур напоминают африканские лики. Они как будто владеют знанием жуткого, магического ритуала. Данный факт имеет свою подоплеку, ведь в 1907 году в Париже проходила выставка, посвященная культуре и быту народов Африки. В своем произведении Пикассо по-новому воссоздал увиденные ритуальные маски африканцев. На картине — таинственные, пугающие зрителя существа, которые завораживают своей неподвижностью. Мастер создал мрачные и загадочные образы, которые подавляют мысли, инстинкты и чувства, довлеют над зрителем. Именно отсюда идет «демонизм» в творчестве мастера, о котором так много говорят критики. Пикассо ставил перед собой задачу перенести объемную форму на плоскость, расчленить ее на геометрические составляющие, а также решить поиск экспрессивной деформации, выразить гротеск. Ему удается насытить фигуры мощной силой и жутковатой агрессией. В картине присутствуют охристо-розовые цвета и синеватый тон, как дань уже ушедших «голубого и розового» периодов в творчестве художника. Угловато-острые элементы рисунка напоминают технику Матисса. Расположение, группировка фигур — это, скорее всего, от Сезанна, который вдохновил своими «Купальщицами» немало художников-кубистов. Несомненно, картина имеет традиционное и в то же время новаторское начало. Переплетение этих двух квинтэссенций несет зашифрованность и аллегоричность сюжета. Тут господствуют варварские истоки, стихийные, с хаотичными вкраплениями, когда вся история была соткана из мифов и сказаний. Парижская богема приняла «Девиц» не однозначно. А. Матисс усмотрел в этом произведении ключ к новому развитию изобразительного искусства, приревновал, а потому отошел к тем, кто был против картины. Жорж Брак, наоборот, настолько восхитился изображением, что она вдохновила его на создание своей «Обнаженной». История написания полотна, также, тесно связана с личным кризисом отношений мастера и Фернанды Оливье — они девять лет вместе, Пикассо начинает тяготиться этими отношениями, и решает проверить чувства альтернативными связями. В картине нет сюжетности, она наполнена неким мистическим смыслом. Ее язык необычен и нов, а сама манера исполнения стала значительным событием в изобразительном искусстве того времени. Своим названием полотно обязано Анре Сальмону — поэту и близкому другу Пикассо. ", 1907.," 243,9 x 233,7 см.", холст., масло., ню., кубизм.," Музей современного искусства, Нью-Йорк, США."
687,Пикассо Пабло,Муза,https://opisanie-kartin.ru/pikasso-pablo/muza/,  , 1935., 130 x 162 см., холст., масло., ню.," кубизм, сюрреализм.", нет данных.
688,Пикассо Пабло,Старый слепой гитарист,https://opisanie-kartin.ru/pikasso-pablo/staryj-slepoj-gitarist/,"  Один из самых трогательных периодов творчества Пабло Пикассо – именно голубая пора. В это время ближайший друг художника уходит из жизни из-за неразделенной любви, все внутреннее состояние мастера претерпевает сильнейшие изменения. Меняется и художественная техника написания картин. Холодный синий цвет – выражение тоски, фрустрации, доброй грусти, холодности – интерпретировать его можно совершенно по-разному, но почему-то художник выбирает именно синюю палитру цветов. Драма, грусть, манера написания, цветовое оформление – все, что характерно для «голубой поры» Пикассо мы видим в картине «Старый гитарист». В оборванных лохмотьях, согнув спину и скрестив ноги, человек, которого мы видим на картине Пабло, по мнению многих искусствоведов – дань уважения другому художнику-маньеристу – Эль Греко. Замкнутое пространство картины словно заставляет этого старца сгибаться, давит на него. Безысходность, чувство давления и бесконечного одиночества заключается в этом полотне. Тонкие пальцы, вытянутые кисти рук – все это выдает физическую слабость изображаемого, но при всем этом старец оказывается слеп. Стоит отметить, что слепота изображается Пикассо во многих полотнах, как признак полной беспомощности и опустения. При этом картины, изображающие слепых людей, создаются Пикассо таким образом, что вызывают наибольший эмоциональный отклик зрителя. Примечательно, что при рентгеновском анализе картины на ней был обнаружен первоначальный рисунок – кормящая грудью женщина, также выписанная в голубых тонах. Ее фигура располагалась прямо «позади» старика, а также на картине были распознаны изображения молодой коровы и теленка. ", 1903.," 121,3 x 82,5 см.", холст., масло., жанровая живопись., экспрессионизм.," Чикагский художественный институт, Чикаго, США."
689,Пикассо Пабло,Наука и милосердие,https://opisanie-kartin.ru/pikasso-pablo/nauka-i-miloserdie/,  , 1897.," 249,5 x 197 см.", холст., масло., жанровая живопись., реализм.," Музей Пикассо, Барселона, Испания."
690,Пикассо Пабло,Герника,https://opisanie-kartin.ru/pikasso-pablo/gernika/," Бомбардировка нацистами города вольнолюбивых басков в апреле 1937 года вызвала в мире всеобщий протест. Этот протестный настрой мировой общественности четко выразил Пабло Пикассо в поразительной картине «Герника». В ней струнами рвущихся нервов звенят насилие и горе, страдания и агония. Из этого полотна втекает в душу поражённого зрителя трагическое ощущение уничтожения, смерти, разрухи, апокалипсиса. На картине нет изображения города и падающих бомб, только языки пламени. Передаваемые образы упрощены до предела. У зрителя создаётся ощущение, что он попал в жуткий подвал. У женщины и мужчины, которые обращены лицами к зрителю, рты широко открыты, искажены болью, они кричат. Отверстия ноздрей и глаза сдвинуты выше лба. Другие фигуры, что в правой зоне полотна, объятые паническим ужасом, пытаются бежать прочь от пылающего здания. Женщина падает из окна горящего дома. Вблизи мужчины, поднявшего вверх руки, Пабло Пикассо изобразил очертания двух человеческих лиц. Они встревожены, напряжены, но наполнены решимостью. Яркой фигурой левой части полотна становится рыдающая мать. Голова женщины запрокинута назад, в руках — мертвый малыш. Это олицетворение горя всех матерей, потерявших детей. А рядом — образ быка, символизирующий равнодушие, жёсткость. Другими словами, всё то, что олицетворяет фашизм. Животное топчет сражённого воина, напоминающего распятие. В отрубленной руке погибшего солдата — сломанный меч. Этот персонаж — символ физического страдания. Здесь и образ лошади — также страдание безвинных, она бьётся в конвульсиях. Женщина, которая профилем напоминает античную богиню, в выдвинутой вперёд руке крепко удерживает горящий светильник. Зрачок ей заменяет электрическая лампочка. Она захлёбывается криком, о чём свидетельствует широко раскрытый рот, но слушать ее здесь больше некому. А над этим миром, поглощаемым хаосом, горит лампа накаливания. Повсюду гибель и разрушения. Боль, гнев и потребность в возмездии сквозят в каждом уголке картины «Герника». Характерные линии усиливают ощущения: то они круглые и тонкие, то вдруг становятся преломляющимися, острыми. Они отражают человеческую психику, погрязшую в страданиях и ужасе. ", 1937., 349 × 776 см., холст., масло., символическая живопись., сюрреализм.," Музей королевы Софии, Мадрид, Испания."
691,Пимоненко Николай,Жатва на Украине,https://opisanie-kartin.ru/pimonenko-nikolaj/zhatva-na-ukraine/,  , 1896., нет данных., холст., масло., жанровая живопись.," реализм, романтизм."," Волгоградский областной музей изобразительных искусств, Волгоград, Россия."
692,Пимоненко Николай,Сваты,https://opisanie-kartin.ru/pimonenko-nikolaj/svaty/,  , 1896., 72 x 102 см., холст., масло., жанровая живопись., реализм., Краснодарский краевой художественный музей имени Ф. А. Коваленко.
693,Пиросмани Нико,Друзья Бегоса,https://opisanie-kartin.ru/pirosmani-niko/druzya-begosa/,  , 1910-е., 113 x 177 см., клеенка., масло., жанровая живопись., примитивизм.," Государственный музей искусства народов Востока, Москва, Россия."
694,Пиросмани Нико,Вывеска пивной Закатала,https://opisanie-kartin.ru/pirosmani-niko/vyveska-pivnoj-zakatala/,  , нет данных., 92 x 120 см., клеенка., масло., реклама., примитивизм.," Государственный музей искусств Грузии, Тбилиси, Грузия."
695,Пиросмани Нико,Рыбак среди скал,https://opisanie-kartin.ru/pirosmani-niko/rybak-sredi-skal/,  , 1906.," 125,5 x 53,1 см.", клеенка., масло., портрет., примитивизм.," Государственная Третьяковская галерея, Москва, Россия."
696,Пластов Аркадий,Сенокос,https://opisanie-kartin.ru/plastov-arkadij/senokos/,"  Картина Аркадия Пластова «Сенокос» — одна из самых известных работ художника, которую он написал в 1945 году. На картине изображен самый разгар лета, цветущий луг очаровывает зрителя своими яркими красками, кажется, что работа наполнена и звуками: поют косы, шелестят травы и листья, щебечут птицы, жужжат насекомые. Лето в деревне даже для детей — это не просто отдых и каникулы — это труд и помощь всей семье. В деревне сенокос, как правило, начинался в середине лета — июле. Крестьяне целые дни проводили в поле, слаженно трудясь, подбадривая себя песнями. Картина «Сенокос» показывает зрителям не только непростой крестьянский труд, но и своеобразное единение, гармонию человека и природы. Кажется, что в картине переданы и запахи: свежескошенной травы, теплого ароматного ветерка. Аркадий Пластов вырос в деревне, поэтому, он, как никто другой смог передать настроение и чувства крестьянской семьи, работающей в поле. Подросток, ловко орудующий косой, кажется нисколько не уставшим, видимо, дело в том, что за время недавней войны, оставшись главой семьи, он привык полностью рассчитывать только на свои силы. Женщина в простом платье и косынке — собирательный образ крестьянки тех лет. Она тоже загорелая и готовая к тяжелому труду — война закалила и ее. Следующий персонаж — это мужчина средних лет, только вернувшись с войны, он сразу взял хозяйство в свои руки — медлить нельзя, иначе зимой вся семья будет страдать от голода. Последний косарь — мужчина в годах, с седой бородой, многое переживший, но он тоже старается не отставать от молодых и крепких работников. Точность передачи изображения Пластовым можно сравнить с фотографичностью работ Шишкина, яркость красок — с произведениями Кустодиева, любовь к родной природе — с творениями Левитана. Цветочный луг пестрит самыми разнообразными оттенками: и красными, и фиолетовыми, и розовыми. Не обошлось и без традиционного символа России — изящных стройных березок. Картина Аркадия Пластова «Сенокос» — это настоящий гимн и родной природе, и мирной жизни, и трудолюбивым людям. Вся красота летней русской природы здесь не воспринимается в отрыве от простого крестьянского труда. ", 1945., 193 x 232 см., холст., масло., жанровая живопись., соцреализм.," Государственная Третьяковская галерея, Москва, Россия."
697,Пластов Аркадий,Первый снег,https://opisanie-kartin.ru/plastov-arkadij/pervyj-sneg/,"  В произведениях Аркадия Пластова невооруженным взглядом видна неподдельная любовь к сельской жизни, крестьянству; именно этой теме посвящены многие его работы. Одна из самых известных его картин на эту тему — «Первый снег». На ней художник изобразил простой сюжет из деревенской жизни — декорациями являются изба, палисадник перед ней, береза. Но главное на картине — снегопад. На крыльце старенькой деревенской избы стоят двое детей — видимо, брат и сестра, и завороженно смотрят на падающий с неба снег. Мягким белым ковром покрывают миллионы кружащихся в танце снежинок землю, деревья, постройки. Это зрелище поражает и завораживает их — видно, что они очень долго ждали этого события. На лицах детей застыли улыбки — чистые, искренние, какие могут быть только у людей, способных находить красоту в простых обыденных вещах. Видимо, дети, увидев за окном падающий снег, собирались на улицу второпях, девочка накинула лишь шерстяной платок поверх платья, но своего младшего брата одела теплее: на нем пальтишко и шапка. Ноги детей обуты в валенки — обычную деревенскую зимнюю обувь. Цветовое решение, выбранное художником для этой работы, создает некоторое однообразие, на картине преобладают белые, серые и коричневые цвета. Несмотря на это, полотно нисколько не наскучивает зрителю. Восторженные взгляды детей вторят чистому свежему снегу. Снежинки ласково касаются их лиц, которые светятся теплом и радостью. ", 1946., 146 x 113 см., холст., масло., жанровая живопись., соцреализм.," Тверская областная картинная галерея, Тверь, Россия."
698,Пластов Аркадий,Фашист пролетел,https://opisanie-kartin.ru/plastov-arkadij/fashist-proletel/,  , 1942., 138 x 185 см., холст., масло., жанровая живопись., соцреализм.," Государственная Третьяковская галерея, Москва, Россия."
699,Пластов Аркадий,Весна. В бане,https://opisanie-kartin.ru/plastov-arkadij/vesna-v-bane/,  , 1954., 210 x 123 см., холст., масло., жанровая живопись., реализм.," Государственная Третьяковская галерея, Москва, Россия."
